{"schema":"artifact-record/v1","artifact_id":"artifact-tools","role":"tool_configuration","media_type":"application/json","content_sha256":"aaaaaaaaaaaaaaaaaaaaaaaaaaaaaaaaaaaaaaaaaaaaaaaaaaaaaaaaaaaaaaaa","size_bytes":12,"storage_class":"core_store","locator":"artifacts/tools.json","redaction_state":"not_required","created_at":"2026-08-25T00:00:00Z"}
